pc_number,attachments,text,date,act,precis
2002-1028,," PC Number Date Chapter Bill Dept 2002-10282002-06-110, , , ICC, DPM, PrecisApproval of the re-appointment by the Minister of State, Deputy Prime Minister and Minister of Infrastructure and Crown Corporations of GÉRALD PRÉFONTAINE, of Ottawa, Ontario, as a director of the Board of Directors of the Canada Post Corporation to hold office during pleasure for a term of two years. Attachments",2002-06-11,NA,"Approval of the re-appointment by the Minister of State, Deputy Prime Minister and Minister of Infrastructure and Crown Corporations of GÉRALD PRÉFONTAINE, of Ottawa, Ontario, as a director of the Board of Directors of the Canada Post Corporation to hold office during pleasure for a term of two years."
2002-1132,," PC Number Date Chapter Bill Dept 2002-11322002-06-210, , DPM, FIN, , PrecisApproval of the re-appointment by the Deputy Prime Minister, Minister of Finance and Minister of Infrastructure, who continues to have responsibility for the control and supervision of the Royal Canadian Mint under Order in Council P.C. 2002-28 of January 15, 2002, of TIMOTHY SPIEGEL of Kelowna, British Columbia, as a director of the Board of Directors of the Royal Canadian Mint to hold office during pleasure for a term of three years. Attachments",2002-06-21,NA,"Approval of the re-appointment by the Deputy Prime Minister, Minister of Finance and Minister of Infrastructure, who continues to have responsibility for the control and supervision of the Royal Canadian Mint under Order in Council P.C. 2002-28 of January 15, 2002, of TIMOTHY SPIEGEL of Kelowna, British Columbia, as a director of the Board of Directors of the Royal Canadian Mint to hold office during pleasure for a term of three years."
2002-1204,," PC Number Date Chapter Bill Dept 2002-12042002-07-160, , , , INDUSTRYPrecisApproval of the reappointment by the Minister of Industry of ORYSSIA J. LENNIE, of Edmonton, Alberta, Deputy Minister of Western Economic Diversification, as a director of the Board of Directors of the Business Development Bank of Canada to hold office during pleasure for a term of two years. Attachments",2002-07-16,NA,"Approval of the reappointment by the Minister of Industry of ORYSSIA J. LENNIE, of Edmonton, Alberta, Deputy Minister of Western Economic Diversification, as a director of the Board of Directors of the Business Development Bank of Canada to hold office during pleasure for a term of two years."
2002-1336,," PC Number Date Chapter Bill Dept 2002-13362002-08-060PMO, IA&ND, , , , , , , PrecisAppointment of ALAIN JOLICOEUR, of Aylmer, Quebec, to be Deputy Minister of Indian Affairs and Northern Development, to hold office during pleasure, effective August 12, 2002. Attachments",2002-08-06,NA,"Appointment of ALAIN JOLICOEUR, of Aylmer, Quebec, to be Deputy Minister of Indian Affairs and Northern Development, to hold office during pleasure, effective August 12, 2002."
2002-1341,," PC Number Date Chapter Bill Dept 2002-13412002-08-060PCO, PMO, , , , , , , , PrecisAppointment of ROBERT FONBERG, of Ottawa, Ontario, to be Deputy Secretary to the Cabinet (Operations), Privy Council Office, to hold office during pleasure, effective September 3, 2002. Attachments",2002-08-06,NA,"Appointment of ROBERT FONBERG, of Ottawa, Ontario, to be Deputy Secretary to the Cabinet (Operations), Privy Council Office, to hold office during pleasure, effective September 3, 2002."
2002-1343,," PC Number Date Chapter Bill Dept 2002-13432002-08-060, , , , PCO, PMO, , , , PrecisAppointment of KATHLEEN O'HARA, of Ottawa, Ontario, to be Deputy Secretary to the Cabinet (Machinery of Government), Privy Council Office, to hold office during pleasure, effective September 3, 2002. Attachments",2002-08-06,NA,"Appointment of KATHLEEN O'HARA, of Ottawa, Ontario, to be Deputy Secretary to the Cabinet (Machinery of Government), Privy Council Office, to hold office during pleasure, effective September 3, 2002."
2002-1345,," PC Number Date Chapter Bill Dept 2002-13452002-08-060, , , , , , , , PCO, PMOPrecisAppointment of JANICE CHARETTE, of Ottawa, Ontario, to be Deputy Secretary to the Cabinet (Plans and Consultation), Privy Council Office, to hold office during pleasure, effective September 3, 2002. Attachments",2002-08-06,NA,"Appointment of JANICE CHARETTE, of Ottawa, Ontario, to be Deputy Secretary to the Cabinet (Plans and Consultation), Privy Council Office, to hold office during pleasure, effective September 3, 2002."
2002-1347,," PC Number Date Chapter Bill Dept 2002-13472002-08-060, , HERITAGE, PMO, , , , , PrecisAppointment of THOMAS E. LEE, of Ottawa, Ontario, to be Special Advisor to the Deputy Minister of Canadian Heritage, to hold office during pleasure, for a term ending January 28, 2003, effective August 7, 2002. Attachments",2002-08-06,NA,"Appointment of THOMAS E. LEE, of Ottawa, Ontario, to be Special Advisor to the Deputy Minister of Canadian Heritage, to hold office during pleasure, for a term ending January 28, 2003, effective August 7, 2002."
2002-1349,," PC Number Date Chapter Bill Dept 2002-13492002-08-060, , , , , , EDAC-RQ, PMO, PrecisAppointment of PIERRE REID, of Sherbrooke, Quebec, to be Special Advisor to the Deputy Minister, Economic Development Agency of Canada for the Regions of Quebec, to hold office during pleasure, effective September 3, 2002. Attachments",2002-08-06,NA,"Appointment of PIERRE REID, of Sherbrooke, Quebec, to be Special Advisor to the Deputy Minister, Economic Development Agency of Canada for the Regions of Quebec, to hold office during pleasure, effective September 3, 2002."
2002-1537,," PC Number Date Chapter Bill Dept 2002-15372002-09-170, , PMO, TB, , , , , , PrecisAppointment of RUTH DANTZER of Ottawa, Ontario, to be Associate Secretary of the Treasury Board, to hold office during pleasure, effective September 23, 2002. Attachments",2002-09-17,NA,"Appointment of RUTH DANTZER of Ottawa, Ontario, to be Associate Secretary of the Treasury Board, to hold office during pleasure, effective September 23, 2002."
2002-1539,," PC Number Date Chapter Bill Dept 2002-15392002-09-170, , , , , , INDUSTRY, PMO, , PrecisAppointment of CAROLE SWAN of Ottawa, Ontario, to be Associate Deputy Minister of Industry, to hold office during pleasure, effective September 23, 2002. Attachments",2002-09-17,NA,"Appointment of CAROLE SWAN of Ottawa, Ontario, to be Associate Deputy Minister of Industry, to hold office during pleasure, effective September 23, 2002."
2002-1541,," PC Number Date Chapter Bill Dept 2002-15412002-09-170, , , , F&O, PMOPrecisAppointment of JEAN-CLAUDE BOUCHARD of Ottawa, Ontario, to be Associate Deputy Minister of Fisheries and Oceans, to hold office during pleasure, effective September 23, 2002. Attachments",2002-09-17,NA,"Appointment of JEAN-CLAUDE BOUCHARD of Ottawa, Ontario, to be Associate Deputy Minister of Fisheries and Oceans, to hold office during pleasure, effective September 23, 2002."
2003-0524,2010," PC Number Date Chapter Bill Dept 2003-05242003-04-11, , , , , PMO, , ActSpecial Appointment Regulations, No. 2003-1PrecisAppointment of ROBERT A. WRIGHT of Ottawa, Ontario, to be Associate Secretary to the Cabinet, Deputy Minister to the Deputy Prime Minister and Security and Intelligence Coordinator, to hold office during pleasure, effective June 2, 2003.AttachmentsAttachment",2003-04-11,"Special Appointment Regulations, No. 2003-1","Appointment of ROBERT A. WRIGHT of Ottawa, Ontario, to be Associate Secretary to the Cabinet, Deputy Minister to the Deputy Prime Minister and Security and Intelligence Coordinator, to hold office during pleasure, effective June 2, 2003."
2003-0526,2014," PC Number Date Chapter Bill Dept 2003-05262003-04-11PMO, EC, , , , , , , ActDepartment of the Environment ActPrecisAppointment of SUZANNE HURTUBISE of Ottawa, Ontario, to be Deputy Minister of the Environment, to hold office during pleasure, effective June 2, 2003.AttachmentsAttachment",2003-04-11,Department of the Environment Act,"Appointment of SUZANNE HURTUBISE of Ottawa, Ontario, to be Deputy Minister of the Environment, to hold office during pleasure, effective June 2, 2003."
2003-0528,2018," PC Number Date Chapter Bill Dept 2003-05282003-04-11, , , , PMO, , , , ActSpecial Appointment Regulations, No. 2003-2Public Service Employment ActPrecisAppointment of MARC LAFRENIÈRE of Gatineau, Quebec, to be Deputy Minister of the Economic Development Agency of Canada for the Regions of Quebec, to hold office during pleasure; and designates MARC LAFRENIÈRE as the deputy head of that Agency for the purposes of the Public Service Employment Act; effective April 14, 2003.AttachmentsAttachment",2003-04-11,"Special Appointment Regulations, No. 2003-2
Public Service Employment Act","Appointment of MARC LAFRENIÈRE of Gatineau, Quebec, to be Deputy Minister of the Economic Development Agency of Canada for the Regions of Quebec, to hold office during pleasure; and designates MARC LAFRENIÈRE as the deputy head of that Agency for the purposes of the Public Service Employment Act; effective April 14, 2003."
2003-0531,2024," PC Number Date Chapter Bill Dept 2003-05312003-04-11FAIT, PMO, , , , , , , , ActDepartment of Foreign Affairs and International Trade ActPrecisAppointment of V. PETER HARDER of Ottawa, Ontario, to be Deputy Minister of Foreign Affairs, to hold office during pleasure, effective June 16, 2003.AttachmentsAttachment",2003-04-11,Department of Foreign Affairs and International Trade Act,"Appointment of V. PETER HARDER of Ottawa, Ontario, to be Deputy Minister of Foreign Affairs, to hold office during pleasure, effective June 16, 2003."
2003-0532,2026," PC Number Date Chapter Bill Dept 2003-05322003-04-11, , INDUSTRY, PMO, , , , , , ActDepartment of Industry ActPrecisAppointment of JEAN-CLAUDE VILLIARD of Ottawa, Ontario, to be Deputy Minister of Industry, to hold office during pleasure, effective June 16, 2003.AttachmentsAttachment",2003-04-11,Department of Industry Act,"Appointment of JEAN-CLAUDE VILLIARD of Ottawa, Ontario, to be Deputy Minister of Industry, to hold office during pleasure, effective June 16, 2003."
2003-0533,2032," PC Number Date Chapter Bill Dept 2003-05332003-04-11, , , , , , , , FAIT, PMOActDepartment of Foreign Affairs and International Trade ActPrecisAppointment of JONATHAN FRIED of Ottawa, Ontario, to be Associate Deputy Minister of Foreign Affairs, to hold office during pleasure, effective June 16, 2003.AttachmentsAttachment",2003-04-11,Department of Foreign Affairs and International Trade Act,"Appointment of JONATHAN FRIED of Ottawa, Ontario, to be Associate Deputy Minister of Foreign Affairs, to hold office during pleasure, effective June 16, 2003."
2003-0538,2038," PC Number Date Chapter Bill Dept 2003-05382003-04-11, , , , PMO, F&O, , , , ActDepartment of Fisheries and Oceans ActPrecisAppointment of LARRY MURRAY of Charlottetown, Prince Edward Island, to be Deputy Minister of Fisheries and Oceans, to hold office during pleasure, effective April 22, 2003.AttachmentsAttachment",2003-04-11,Department of Fisheries and Oceans Act,"Appointment of LARRY MURRAY of Charlottetown, Prince Edward Island, to be Deputy Minister of Fisheries and Oceans, to hold office during pleasure, effective April 22, 2003."
2003-0539,2040," PC Number Date Chapter Bill Dept 2003-05392003-04-11, , , , , , PMO, VAC, , ActDepartment of Veterans Affairs ActPrecisAppointment of JOHN E. (JACK) STAGG of Ottawa, Ontario, to be Deputy Minister of Veterans Affairs, to hold office during pleasure, effective April 22, 2003.AttachmentsAttachment",2003-04-11,Department of Veterans Affairs Act,"Appointment of JOHN E. (JACK) STAGG of Ottawa, Ontario, to be Deputy Minister of Veterans Affairs, to hold office during pleasure, effective April 22, 2003."
2003-0545,2064," PC Number Date Chapter Bill Dept 2003-05452003-04-11, , , , , , PWGS, PMOActDepartment of Public Works and Government Services ActPrecisAppointment of I. DAVID MARSHALL of Toronto, Ontario, to be Deputy Minister of Public Works and Government Services, to hold office during pleasure, effective June 16, 2003.AttachmentsAttachment",2003-04-11,Department of Public Works and Government Services Act,"Appointment of I. DAVID MARSHALL of Toronto, Ontario, to be Deputy Minister of Public Works and Government Services, to hold office during pleasure, effective June 16, 2003."
2003-0547,2068," PC Number Date Chapter Bill Dept 2003-05472003-04-11, , , , PMO, PWGS, , ActSpecial Appointment Regulations, No. 2003-7PrecisAppointment of CHRISTIANE OUIMET of Ottawa, Ontario, to be Associate Deputy Minister of Public Works and Government Services, to hold office during pleasure, effective June 16, 2003.AttachmentsAttachment",2003-04-11,"Special Appointment Regulations, No. 2003-7","Appointment of CHRISTIANE OUIMET of Ottawa, Ontario, to be Associate Deputy Minister of Public Works and Government Services, to hold office during pleasure, effective June 16, 2003."
2003-0548,2070," PC Number Date Chapter Bill Dept 2003-05482003-04-11, , , , , , PMO, NDActNational Defence ActPrecisAppointment of HÉLÈNE GOSSELIN of Ottawa, Ontario, to be Associate Deputy Minister of National Defence, to hold office during pleasure, effective April 22, 2003.AttachmentsAttachment",2003-04-11,National Defence Act,"Appointment of HÉLÈNE GOSSELIN of Ottawa, Ontario, to be Associate Deputy Minister of National Defence, to hold office during pleasure, effective April 22, 2003."
2003-0619,2074," PC Number Date Chapter Bill Dept 2003-06192003-05-01, , RESOURCES, PMO, , , , ActSpecial Appointment Regulations, No. 2003-8PrecisAppointment of NAWAL KAMEL to be Special Advisor to the Deputy Minister of Natural Resources, to hold office during pleasure, effective June 23, 2003.AttachmentsAttachment",2003-05-01,"Special Appointment Regulations, No. 2003-8","Appointment of NAWAL KAMEL to be Special Advisor to the Deputy Minister of Natural Resources, to hold office during pleasure, effective June 23, 2003."
2003-1033,3093," PC Number Date Chapter Bill Dept 2003-10332003-06-19, , , PMO, FIN, , , , ActSpecial Appointment Regulations, No. 2003-11PrecisAppointment of MUNIR SHEIKH of Ottawa, Ontario, to be Associate Deputy Minister of Finance, to hold office during pleasure, effective July 2, 2003.AttachmentsAttachment",2003-06-19,"Special Appointment Regulations, No. 2003-11","Appointment of MUNIR SHEIKH of Ottawa, Ontario, to be Associate Deputy Minister of Finance, to hold office during pleasure, effective July 2, 2003."
2003-1035,3097," PC Number Date Chapter Bill Dept 2003-10352003-06-19, , , , , , , PMO, HEALTHActSpecial Appointment Regulations, No. 2003-12PrecisAppointment of JANICE CHARETTE of Ottawa, Ontario, to be Associate Deputy Minister of Health, to hold office during pleasure, effective July 2, 2003.AttachmentsAttachment",2003-06-19,"Special Appointment Regulations, No. 2003-12","Appointment of JANICE CHARETTE of Ottawa, Ontario, to be Associate Deputy Minister of Health, to hold office during pleasure, effective July 2, 2003."
2003-1037,3101," PC Number Date Chapter Bill Dept 2003-10372003-06-19, , , , PMO, PCO, , , , ActSpecial Appointment Regulations, No. 2003-13PrecisAppointment of MICHAEL WERNICK of Ottawa, Ontario, to be Deputy Secretary to the Cabinet (Plans and Consultations), Privy Council Office, to hold office during pleasure, effective July 2, 2003.AttachmentsAttachment",2003-06-19,"Special Appointment Regulations, No. 2003-13","Appointment of MICHAEL WERNICK of Ottawa, Ontario, to be Deputy Secretary to the Cabinet (Plans and Consultations), Privy Council Office, to hold office during pleasure, effective July 2, 2003."
2003-1039,3105," PC Number Date Chapter Bill Dept 2003-10392003-06-19, , , , , , , , PMO, CITIZENSHIPActSpecial Appointment Regulations, No. 2003-14PrecisAppointment of DIANE VINCENT of Ottawa, Ontario, to be Associate Deputy Minister of Citizenship and Immigration, to hold office during pleasure, effective July 2, 2003.AttachmentsAttachment",2003-06-19,"Special Appointment Regulations, No. 2003-14","Appointment of DIANE VINCENT of Ottawa, Ontario, to be Associate Deputy Minister of Citizenship and Immigration, to hold office during pleasure, effective July 2, 2003."
2003-1505,4106," PC Number Date Chapter Bill Dept 2003-15052003-10-02, , , , JUS, PMOActDepartment of Justice ActPrecisAppointment of MICHEL BOUCHARD of Cap Rouge, Quebec, to be Associate Deputy Minister of Justice, to hold office during pleasure, effective October 2, 2003.AttachmentsAttachment",2003-10-02,Department of Justice Act,"Appointment of MICHEL BOUCHARD of Cap Rouge, Quebec, to be Associate Deputy Minister of Justice, to hold office during pleasure, effective October 2, 2003."
2003-2110,5290," PC Number Date Chapter Bill Dept 2003-21102003-12-12, , , PMO, SGC, , ActDepartment of the Solicitor General ActPrecisAppointment of MARGARET BLOODWORTH of Ottawa, Ontario, to be Deputy Solicitor General, to be styled Deputy Minister of Public Safety and Emergency Preparedness, to hold office during pleasure, effective December 12, 2003.AttachmentsAttachment",2003-12-12,Department of the Solicitor General Act,"Appointment of MARGARET BLOODWORTH of Ottawa, Ontario, to be Deputy Solicitor General, to be styled Deputy Minister of Public Safety and Emergency Preparedness, to hold office during pleasure, effective December 12, 2003."
2003-2116,5366," PC Number Date Chapter Bill Dept 2003-21162003-12-12, , , , , , , EC, PMOActSpecial Appointment Regulations, No. 2003-20PrecisAppointment of CATHERINE (CASSIE) DOYLE of Ottawa, Ontario, to be Associate Deputy Minister of the Environment, to hold office during pleasure, effective December 12, 2003.AttachmentsAttachment",2003-12-12,"Special Appointment Regulations, No. 2003-20","Appointment of CATHERINE (CASSIE) DOYLE of Ottawa, Ontario, to be Associate Deputy Minister of the Environment, to hold office during pleasure, effective December 12, 2003."
2003-2117,5213," PC Number Date Chapter Bill Dept 2003-21172003-12-12IA&ND, PMO, , , , , , , ActDepartment of Indian Affairs and Northern Development ActPrecisAppointment of J. MICHAEL HORGAN of Ottawa, Ontario, to be Deputy Minister of Indian Affairs and Northern Development, to hold office during pleasure, effective December 12, 2003.AttachmentsAttachment",2003-12-12,Department of Indian Affairs and Northern Development Act,"Appointment of J. MICHAEL HORGAN of Ottawa, Ontario, to be Deputy Minister of Indian Affairs and Northern Development, to hold office during pleasure, effective December 12, 2003."
2003-2118,5215," PC Number Date Chapter Bill Dept 2003-21182003-12-12, , PMO, HRD, , , , , ActDepartment of Human Resources Development ActPrecisAppointment of NICOLE JAUVIN, of Ottawa, Ontario, to be Deputy Minister of Human Resources Development, to be styled Deputy Minister of Social Development, to hold office during pleasure, effective December 12, 2003.AttachmentsAttachment",2003-12-12,Department of Human Resources Development Act,"Appointment of NICOLE JAUVIN, of Ottawa, Ontario, to be Deputy Minister of Human Resources Development, to be styled Deputy Minister of Social Development, to hold office during pleasure, effective December 12, 2003."
2003-2122,5389," PC Number Date Chapter Bill Dept 2003-21222003-12-12, , PMO, , , , , ActSpecial Appointment Regulations, No. 2003-22PrecisAppointment of ROBERT A. WRIGHT of Ottawa, Ontario, to be Associate Secretary to the Cabinet and National Security Advisor to the Prime Minister, to hold office during pleasure, effective December 12, 2003.AttachmentsAttachment",2003-12-12,"Special Appointment Regulations, No. 2003-22","Appointment of ROBERT A. WRIGHT of Ottawa, Ontario, to be Associate Secretary to the Cabinet and National Security Advisor to the Prime Minister, to hold office during pleasure, effective December 12, 2003."
2003-2123,5588," PC Number Date Chapter Bill Dept 2003-21232003-12-12, , , ND, PMO, , , ActNational Defence ActPrecisAppointment of HÉLÈNE GOSSELIN of Ottawa, Ontario, an Associate Deputy Minister of National Defence, to be Acting Deputy Minister of National Defence, effective December 12, 2003, to hold office during pleasure, until a Deputy Minister of National Defence is appointed.AttachmentsAttachment",2003-12-12,National Defence Act,"Appointment of HÉLÈNE GOSSELIN of Ottawa, Ontario, an Associate Deputy Minister of National Defence, to be Acting Deputy Minister of National Defence, effective December 12, 2003, to hold office during pleasure, until a Deputy Minister of National Defence is appointed."
2003-2126,5393," PC Number Date Chapter Bill Dept 2003-21262003-12-12, , , , PMO, FAIT, , , , ActDepartment of Foreign Affairs and International Trade ActPrecisAppointment of MARIE-LUCIE MORIN of Ottawa, Ontario, to be Associate Deputy Minister of Foreign Affairs, to hold office during pleasure, effective December 12, 2003.AttachmentsAttachment",2003-12-12,Department of Foreign Affairs and International Trade Act,"Appointment of MARIE-LUCIE MORIN of Ottawa, Ontario, to be Associate Deputy Minister of Foreign Affairs, to hold office during pleasure, effective December 12, 2003."
2003-2127,5370," PC Number Date Chapter Bill Dept 2003-21272003-12-12PMO, NRCAN, , , , , , , , ActNorthern Pipeline ActPrecisAppointment of GEORGE R.M. ANDERSON, Deputy Minister of Natural Resources, to be the Commissioner of the Northern Pipeline Agency, to hold office during pleasure, in the place of Leonard Edwards.AttachmentsAttachment",2003-12-12,Northern Pipeline Act,"Appointment of GEORGE R.M. ANDERSON, Deputy Minister of Natural Resources, to be the Commissioner of the Northern Pipeline Agency, to hold office during pleasure, in the place of Leonard Edwards."
2003-2129,5397," PC Number Date Chapter Bill Dept 2003-21292003-12-12, , , , , , PMO, HRD, , ActDepartment of Human Resources Development ActSpecial Appointment Regulations, No. 2003-24PrecisAppointment of WAYNE WOUTERS of Ottawa, Ontario, to be Deputy Minister of Human Resources and Skills Development, to hold office during pleasure; to be concurrently an Associate Deputy Minister of Human Resources Development, to hold office during pleasure, and as a commissioner of the Canada Employment Insurance Commission, to be the Vice-Chairperson of the Commission, effective December 12, 2003.AttachmentsAttachment",2003-12-12,"Department of Human Resources Development Act
Special Appointment Regulations, No. 2003-24","Appointment of WAYNE WOUTERS of Ottawa, Ontario, to be Deputy Minister of Human Resources and Skills Development, to hold office during pleasure; to be concurrently an Associate Deputy Minister of Human Resources Development, to hold office during pleasure, and as a commissioner of the Canada Employment Insurance Commission, to be the Vice-Chairperson of the Commission, effective December 12, 2003."
2003-2131,5401," PC Number Date Chapter Bill Dept 2003-21312003-12-12, , , , , , PMO, HRD, ActDepartment of Human Resources Development ActSpecial Appointment Regulations, No. 2003-25PrecisAppointment of MARYANTONETT FLUMIAN of Ottawa, Ontario, to be Associate Deputy Minister of Human Resources and Skills Development, to hold office during pleasure; and to be concurrently an Associate Deputy Minister of Human Resources Development, to hold office during pleasure, effective December 12, 2003.AttachmentsAttachment",2003-12-12,"Department of Human Resources Development Act
Special Appointment Regulations, No. 2003-25","Appointment of MARYANTONETT FLUMIAN of Ottawa, Ontario, to be Associate Deputy Minister of Human Resources and Skills Development, to hold office during pleasure; and to be concurrently an Associate Deputy Minister of Human Resources Development, to hold office during pleasure, effective December 12, 2003."
2004-0397,6444," PC Number Date Chapter Bill Dept 2004-03972004-04-08, , , , PMO, , ActSpecial Appointment Regulations, No. 2004-2PrecisAppointment of MARIE E. FORTIER of Ottawa, Ontario, to be Deputy Minister (Intergovernmental Affairs), Privy Council Office, to hold office during pleasure, effective April 26, 2004.AttachmentsAttachment",2004-04-08,"Special Appointment Regulations, No. 2004-2","Appointment of MARIE E. FORTIER of Ottawa, Ontario, to be Deputy Minister (Intergovernmental Affairs), Privy Council Office, to hold office during pleasure, effective April 26, 2004."
2004-0399,6448," PC Number Date Chapter Bill Dept 2004-03992004-04-08PMO, , , , , , ActSpecial Appointment Regulations, No. 2004-3PrecisAppointment of MICHELLE d'AURAY of Ottawa, Ontario, to be Deputy Minister of the Economic Development Agency of Canada for the Regions of Quebec, to hold office during pleasure, effective May 10, 2004.AttachmentsAttachment",2004-04-08,"Special Appointment Regulations, No. 2004-3","Appointment of MICHELLE d'AURAY of Ottawa, Ontario, to be Deputy Minister of the Economic Development Agency of Canada for the Regions of Quebec, to hold office during pleasure, effective May 10, 2004."
2004-0400,6452," PC Number Date Chapter Bill Dept 2004-04002004-04-08, PMO, , , , , ActDepartment of Foreign Affairs and International Trade ActPrecisAppointment of ROBERT FONBERG of Nepean, Ontario, to be Associate Deputy Minister of Foreign Affairs, to hold office during pleasure; and designation of ROBERT FONBERG, an Associate Deputy Minister of Foreign Affairs, to be Deputy Minister for International Trade; effective May 10, 2004.AttachmentsAttachment",2004-04-08,Department of Foreign Affairs and International Trade Act,"Appointment of ROBERT FONBERG of Nepean, Ontario, to be Associate Deputy Minister of Foreign Affairs, to hold office during pleasure; and designation of ROBERT FONBERG, an Associate Deputy Minister of Foreign Affairs, to be Deputy Minister for International Trade; effective May 10, 2004."
